{
  "packageType": "world-model-elicitation",
  "runtimeVersion": "0.5.5",
  "packageId": "WME-PKG-001",
  "worldModelElicitationSessions": [
    {
      "id": "WME-SES-001",
      "target": "Cube rolling control requirements",
      "purpose": "Converge ambiguous level-4 spatial requirements into a closed world model before World Model Review.",
      "level": "level-4",
      "rawIntentRefs": [
        "RIN-WME-001"
      ],
      "modelHypothesisRefs": [
        "HYP-WME-001",
        "HYP-WME-002",
        "HYP-WME-003",
        "HYP-WME-004"
      ],
      "discriminatingQuestionRefs": [
        "DQU-WME-001"
      ],
      "counterexampleSequenceRefs": [
        "CEX-WME-001",
        "CEX-WME-002",
        "CEX-WME-003",
        "CEX-WME-004",
        "CEX-WME-005"
      ],
      "invariantCandidateRefs": [
        "INV-WME-001"
      ],
      "closureAssessmentRef": "CLO-WME-001",
      "status": "closed"
    }
  ],
  "rawIntents": [
    {
      "id": "RIN-WME-001",
      "sessionRef": "WME-SES-001",
      "statement": "The cube should roll up, down, left, right, forward, and backward in a way that feels consistent to the player.",
      "source": "human requirement discussion",
      "captureMode": "interview-note",
      "ambiguitySignals": [
        "reference frame unclear",
        "surface transition semantics unclear",
        "composition behavior unclear"
      ],
      "status": "captured"
    }
  ],
  "modelHypotheses": [
    {
      "id": "HYP-WME-001",
      "sessionRef": "WME-SES-001",
      "sourceRawIntentRefs": [
        "RIN-WME-001"
      ],
      "name": "Cube Local Control Frame",
      "modelType": "coordinate-frame",
      "assumption": "Input directions are interpreted relative to the cube's current local orientation.",
      "predictionSummary": "After rolling upward onto a wall, backward input follows the cube's transformed local frame.",
      "confidence": 0.25,
      "status": "rejected"
    },
    {
      "id": "HYP-WME-002",
      "sessionRef": "WME-SES-001",
      "sourceRawIntentRefs": [
        "RIN-WME-001"
      ],
      "name": "Current Surface Control Frame",
      "modelType": "coordinate-frame",
      "assumption": "Input directions are interpreted relative to the surface the cube is currently contacting.",
      "predictionSummary": "After rolling onto a wall, left/right/up/down are remapped to the wall plane.",
      "confidence": 0.25,
      "status": "rejected"
    },
    {
      "id": "HYP-WME-003",
      "sessionRef": "WME-SES-001",
      "sourceRawIntentRefs": [
        "RIN-WME-001"
      ],
      "name": "World XYZ Control Frame",
      "modelType": "coordinate-frame",
      "assumption": "Input directions are interpreted as absolute world axes.",
      "predictionSummary": "Backward always means negative world Z even when the camera uses a different visual frame.",
      "confidence": 0.2,
      "status": "rejected"
    },
    {
      "id": "HYP-WME-004",
      "sessionRef": "WME-SES-001",
      "sourceRawIntentRefs": [
        "RIN-WME-001"
      ],
      "name": "Fixed Camera Control Frame",
      "modelType": "coordinate-frame",
      "assumption": "Input directions are interpreted from the fixed camera view and do not rotate with cube orientation or current surface.",
      "predictionSummary": "After up then backward, backward means visually backward from the fixed camera.",
      "confidence": 0.9,
      "status": "selected"
    }
  ],
  "discriminatingQuestions": [
    {
      "id": "DQU-WME-001",
      "sessionRef": "WME-SES-001",
      "competingHypothesisRefs": [
        "HYP-WME-001",
        "HYP-WME-002",
        "HYP-WME-003",
        "HYP-WME-004"
      ],
      "scenario": "The cube rolls upward once, then receives a backward input.",
      "questionText": "After the cube moves up once, when the player presses backward, should it move backward as seen from the fixed camera, or backward relative to the cube/surface?",
      "expectedAnswers": [
        {
          "id": "EXP-WME-001-A",
          "answerPattern": "Backward from the fixed camera view.",
          "hypothesesEliminatedRefs": [
            "HYP-WME-001",
            "HYP-WME-002",
            "HYP-WME-003"
          ]
        },
        {
          "id": "EXP-WME-001-B",
          "answerPattern": "Backward from the cube or current surface.",
          "hypothesesEliminatedRefs": [
            "HYP-WME-004"
          ]
        }
      ],
      "informationGain": 0.85,
      "selectionRationale": "This question separates fixed visual control from local, surface, and absolute-axis interpretations with one short state transition.",
      "resultingModelUpdate": "Select fixed camera control frame if answer follows visual backward.",
      "status": "answered"
    }
  ],
  "humanAnswers": [
    {
      "id": "HAN-WME-001",
      "sessionRef": "WME-SES-001",
      "rawIntentRef": "RIN-WME-001",
      "questionRef": "DQU-WME-001",
      "answerText": "Fixed camera. Even after moving up, backward means backward from the camera view.",
      "captureMode": "interview",
      "status": "captured"
    },
    {
      "id": "HAN-WME-002",
      "sessionRef": "WME-SES-001",
      "sequenceRef": "CEX-WME-001",
      "answerText": "Up then up should keep climbing in the same visual up direction.",
      "captureMode": "interview",
      "status": "captured"
    },
    {
      "id": "HAN-WME-003",
      "sessionRef": "WME-SES-001",
      "sequenceRef": "CEX-WME-002",
      "answerText": "Up then down should reverse along the visual path.",
      "captureMode": "interview",
      "status": "captured"
    },
    {
      "id": "HAN-WME-004",
      "sessionRef": "WME-SES-001",
      "sequenceRef": "CEX-WME-003",
      "answerText": "Up then left should move left as seen from the fixed camera, not relative to the cube face.",
      "captureMode": "interview",
      "status": "captured"
    },
    {
      "id": "HAN-WME-005",
      "sessionRef": "WME-SES-001",
      "sequenceRef": "CEX-WME-004",
      "answerText": "Down, left, then down should still use the fixed camera control directions.",
      "captureMode": "interview",
      "status": "captured"
    },
    {
      "id": "HAN-WME-006",
      "sessionRef": "WME-SES-001",
      "sequenceRef": "CEX-WME-005",
      "answerText": "Up then backward should go visually backward from the fixed camera.",
      "captureMode": "interview",
      "status": "captured"
    },
    {
      "id": "HAN-WME-007",
      "sessionRef": "WME-SES-001",
      "invariantCandidateRef": "INV-WME-001",
      "answerText": "Yes, that rule is correct: control direction is fixed to the camera and does not change with cube orientation or surface.",
      "captureMode": "teach-back",
      "status": "captured"
    }
  ],
  "hypothesisEliminations": [
    {
      "id": "HEL-WME-001",
      "sessionRef": "WME-SES-001",
      "answerRef": "HAN-WME-001",
      "eliminatedHypothesisRefs": [
        "HYP-WME-001",
        "HYP-WME-002",
        "HYP-WME-003"
      ],
      "remainingHypothesisRefs": [
        "HYP-WME-004"
      ],
      "rationale": "The answer explicitly chooses fixed camera backward after a prior upward move."
    }
  ],
  "counterexampleSequences": [
    {
      "id": "CEX-WME-001",
      "sessionRef": "WME-SES-001",
      "targetHypothesisRefs": [
        "HYP-WME-001",
        "HYP-WME-002",
        "HYP-WME-004"
      ],
      "explorationType": "repeat",
      "steps": [
        "up",
        "up"
      ],
      "purpose": "Check whether repeated movement remains visually stable after surface transition.",
      "status": "answered"
    },
    {
      "id": "CEX-WME-002",
      "sessionRef": "WME-SES-001",
      "targetHypothesisRefs": [
        "HYP-WME-001",
        "HYP-WME-002",
        "HYP-WME-004"
      ],
      "explorationType": "inverse",
      "steps": [
        "up",
        "down"
      ],
      "purpose": "Check reversal semantics after the first transition.",
      "status": "answered"
    },
    {
      "id": "CEX-WME-003",
      "sessionRef": "WME-SES-001",
      "targetHypothesisRefs": [
        "HYP-WME-001",
        "HYP-WME-002",
        "HYP-WME-004"
      ],
      "explorationType": "orthogonal",
      "steps": [
        "up",
        "left"
      ],
      "purpose": "Expose whether orthogonal movement is cube-relative or camera-relative.",
      "status": "answered"
    },
    {
      "id": "CEX-WME-004",
      "sessionRef": "WME-SES-001",
      "targetHypothesisRefs": [
        "HYP-WME-001",
        "HYP-WME-002",
        "HYP-WME-004"
      ],
      "explorationType": "composition",
      "steps": [
        "down",
        "left",
        "down"
      ],
      "purpose": "Check composed transitions across multiple surfaces.",
      "status": "answered"
    },
    {
      "id": "CEX-WME-005",
      "sessionRef": "WME-SES-001",
      "targetHypothesisRefs": [
        "HYP-WME-001",
        "HYP-WME-002",
        "HYP-WME-003",
        "HYP-WME-004"
      ],
      "explorationType": "reference-frame",
      "steps": [
        "up",
        "backward"
      ],
      "purpose": "Expose the control reference frame directly.",
      "status": "answered"
    }
  ],
  "sequenceExpectations": [
    {
      "id": "SEQ-WME-001",
      "sessionRef": "WME-SES-001",
      "sequenceRef": "CEX-WME-001",
      "answerRef": "HAN-WME-002",
      "affectedHypothesisRefs": [
        "HYP-WME-001",
        "HYP-WME-002",
        "HYP-WME-004"
      ],
      "expectedOutcome": "The cube continues visually upward.",
      "interpretation": "Repeated control remains camera-stable.",
      "status": "confirmed"
    },
    {
      "id": "SEQ-WME-002",
      "sessionRef": "WME-SES-001",
      "sequenceRef": "CEX-WME-002",
      "answerRef": "HAN-WME-003",
      "affectedHypothesisRefs": [
        "HYP-WME-001",
        "HYP-WME-002",
        "HYP-WME-004"
      ],
      "expectedOutcome": "The cube reverses visually downward.",